<?xml version="1.0" encoding="UTF-8"?>
<students xmlns:xsi="http://www.w3.org/2001/XMLSchema-instance" xsi:noNamespaceSchemaLocation="studentSchema.xsd">
  <student>
    <id>001</id>
    <name>Nadika</name>
    <age>23</age>
  </student>
  <student>
    <id>002</id>
    <name>Koshala</name>
    <age>23</age>
  </student>
</students>